Onions, Cheese, Detergent, Bread, Eggs
Soda, Cheese, Juice, Soap, Tomatoes, Toothpaste, Cereal, Butter
Chicken, Fish, Beef, Cereal, Yogurt
Onions, Milk, Bananas, Cereal
Fish, Bread, Soap, Cookies, Beef
Cookies, Apples, Detergent, Bananas, Pasta, Soap, Yogurt, Tomatoes
Chicken, Rice, Eggs, Beef, Chips, Potatoes
Fish, Bread, Bananas, Soap, Yogurt, Cereal, Soda, Potatoes
Soda, Pasta, Soap
Tomatoes, Shampoo, Soap, Toothpaste, Cookies, Cereal, Onions, Beef
Cookies, Fish, Yogurt
Detergent, Apples, Yogurt
Onions, Beef, Fish, Apples, Cereal
Bananas, Chicken, Yogurt
Chicken, Eggs, Tomatoes, Butter, Beef, Milk, Detergent, Toothpaste
Cookies, Toothpaste, Yogurt, Cereal, Soap, Detergent
Chips, Butter, Yogurt, Bananas, Pasta, Chicken, Beef, Shampoo
Shampoo, Beef, Milk, Cookies, Apples, Yogurt
Yogurt, Eggs, Water, Toothpaste
Chips, Beef, Eggs, Pasta, Cheese, Bread
Apples, Shampoo, Cookies, Bananas
Milk, Soda, Water, Cheese, Soap, Potatoes, Apples, Beef
Chicken, Apples, Bread, Yogurt, Detergent, Eggs, Water
Eggs, Toothpaste, Fish
Rice, Apples, Bread
Chips, Detergent, Potatoes
Butter, Fish, Yogurt
Detergent, Beef, Potatoes, Soap, Bread, Tomatoes, Eggs, Water
Bread, Eggs, Yogurt, Detergent, Soda, Chips, Fish, Toothpaste
Bread, Fish, Milk, Apples
Cookies, Shampoo, Pasta, Soda, Butter, Juice
Chips, Shampoo, Beef, Butter, Fish, Rice, Chicken, Toothpaste
Bananas, Beef, Onions, Soda, Milk, Yogurt, Soap
Fish, Bananas, Juice, Rice
Shampoo, Cereal, Detergent
Soda, Eggs, Apples, Juice, Cookies
Chips, Cookies, Cheese, Fish, Tomatoes, Rice, Cereal
Pasta, Onions, Potatoes
Water, Chicken, Soda, Soap
Chicken, Water, Chips, Toothpaste, Beef, Apples, Cereal, Pasta
Toothpaste, Soap, Bread, Tomatoes, Onions, Chicken, Rice, Shampoo
Beef, Detergent, Apples, Tomatoes, Cheese, Onions
Apples, Butter, Yogurt, Rice
Detergent, Cookies, Chips, Tomatoes, Pasta, Beef, Bread
Milk, Tomatoes, Potatoes, Cookies, Cereal, Water, Toothpaste, Soda
Chips, Juice, Butter, Tomatoes
Milk, Rice, Soda
Detergent, Bread, Butter, Soap, Fish, Chips
Toothpaste, Chicken, Juice, Apples, Tomatoes, Bananas
Cheese, Water, Toothpaste
Water, Soda, Cookies, Yogurt, Pasta
Tomatoes, Butter, Pasta, Fish
Apples, Bananas, Detergent, Onions, Water, Pasta, Juice
Pasta, Detergent, Cheese, Bread, Milk, Juice, Water, Butter
Yogurt, Shampoo, Soda, Chips
Yogurt, Bananas, Juice
Toothpaste, Cereal, Onions, Yogurt, Shampoo
Soap, Potatoes, Butter, Eggs, Soda, Fish, Chips, Bananas
Chicken, Juice, Bananas, Chips, Fish
Pasta, Soap, Shampoo, Yogurt, Apples, Milk, Potatoes, Juice
Tomatoes, Bread, Soda
Soap, Onions, Milk, Beef, Fish, Shampoo, Cookies
Cookies, Potatoes, Shampoo, Pasta, Onions, Butter, Soap
Soap, Apples, Eggs, Beef, Water, Cereal
Onions, Cereal, Cheese, Pasta
Cereal, Shampoo, Chicken, Detergent, Butter, Water
Fish, Juice, Cookies, Chips, Onions, Rice, Bananas, Potatoes
Eggs, Chicken, Juice
Detergent, Chicken, Cheese, Onions
Detergent, Soda, Beef
Rice, Cereal, Juice, Butter, Soda, Shampoo, Chicken, Soap
Juice, Bread, Bananas
Toothpaste, Bread, Butter
Bananas, Beef, Milk, Toothpaste, Pasta
Yogurt, Bananas, Beef, Bread, Apples
Chips, Toothpaste, Shampoo, Cookies, Onions, Soda, Butter, Cereal
Bread, Eggs, Fish, Rice
Pasta, Chips, Onions, Potatoes
Apples, Shampoo, Bananas, Butter, Cookies
Rice, Eggs, Onions, Milk, Bananas, Cheese, Chicken, Apples
Onions, Chips, Detergent, Soap, Bananas, Water, Toothpaste
Rice, Juice, Soap, Potatoes, Onions, Milk
Yogurt, Potatoes, Soap
Fish, Detergent, Bread, Onions
Water, Soap, Cheese
Eggs, Water, Potatoes, Rice, Shampoo, Butter, Soap
Bananas, Yogurt, Eggs, Soap
Onions, Cheese, Cookies, Juice
Beef, Chicken, Juice, Fish, Tomatoes, Shampoo
Bread, Soda, Juice, Butter
Shampoo, Toothpaste, Cheese
Juice, Pasta, Butter
Onions, Apples, Yogurt
Detergent, Eggs, Chicken, Toothpaste, Yogurt
Cereal, Bananas, Water
Milk, Water, Butter, Juice, Apples
Fish, Toothpaste, Rice
Chips, Yogurt, Butter, Juice, Cheese, Water, Toothpaste
Cookies, Soda, Rice
Chips, Butter, Pasta
